{
  "model_id": "wm-monthly-report-v1",
  "project_id": "project-monthly-report",
  "version": 1,
  "lifecycle_stage": "AS_IS",
  "title": "월간 매출 보고서 작성",
  "summary": "ERP 매출 데이터를 내려받아 Excel 템플릿에 반영하고 이상 증감을 설명한 뒤 경영진에게 메일로 보내는 업무",
  "model_status": "CONFIRMED",
  "participants": [
    {
      "id": "role-sales-ops",
      "kind": "ROLE",
      "name": "영업기획 담당자",
      "roles": [
        "수행자",
        "보고서 작성자"
      ],
      "responsibilities": [
        "매출 데이터 정합성 확인",
        "월간 보고서 제출"
      ],
      "meta": {
        "state": "CONFIRMED",
        "confidence": 0.9,
        "source_refs": [
          "answer-001"
        ],
        "validated_by": [
          "user-001"
        ],
        "last_validated_at": "2026-07-14T12:00:00+09:00"
      }
    },
    {
      "id": "role-sales-manager",
      "kind": "ROLE",
      "name": "영업기획 팀장",
      "roles": [
        "검토자"
      ],
      "responsibilities": [
        "이상 수치 검토"
      ],
      "meta": {
        "state": "CONFIRMED",
        "confidence": 0.9,
        "source_refs": [
          "answer-001"
        ],
        "validated_by": [
          "user-001"
        ],
        "last_validated_at": "2026-07-14T12:00:00+09:00"
      }
    },
    {
      "id": "stakeholder-executives",
      "kind": "EXTERNAL_PARTY",
      "name": "경영진",
      "roles": [
        "결과 수신자"
      ],
      "responsibilities": [],
      "meta": {
        "state": "CONFIRMED",
        "confidence": 0.9,
        "source_refs": [
          "answer-001"
        ],
        "validated_by": [
          "user-001"
        ],
        "last_validated_at": "2026-07-14T12:00:00+09:00"
      }
    }
  ],
  "goals": [
    {
      "id": "goal-monthly-visibility",
      "statement": "경영진이 전월 실적과 이상 증감을 확인할 수 있게 한다.",
      "beneficiary_refs": [
        "stakeholder-executives"
      ],
      "success_measures": [
        "마감일 오전까지 보고서 발송",
        "합계 오류 없음"
      ],
      "meta": {
        "state": "CONFIRMED",
        "confidence": 0.9,
        "source_refs": [
          "answer-001"
        ],
        "validated_by": [
          "user-001"
        ],
        "last_validated_at": "2026-07-14T12:00:00+09:00"
      }
    }
  ],
  "processes": [
    {
      "id": "process-monthly-report",
      "name": "월간 매출 보고서 작성",
      "description": "월초 ERP 추출부터 보고서 메일 발송까지",
      "owner_refs": [
        "role-sales-ops"
      ],
      "performer_refs": [
        "role-sales-ops"
      ],
      "goal_refs": [
        "goal-monthly-visibility"
      ],
      "trigger": {
        "description": "매월 첫 영업일 오전",
        "event_type": "TIME",
        "meta": {
          "state": "CONFIRMED",
          "confidence": 0.9,
          "source_refs": [
            "answer-001"
          ],
          "validated_by": [
            "user-001"
          ],
          "last_validated_at": "2026-07-14T12:00:00+09:00"
        }
      },
      "completion_condition": {
        "description": "팀장 검토 후 경영진 메일 발송 완료",
        "event_type": "MESSAGE",
        "meta": {
          "state": "CONFIRMED",
          "confidence": 0.9,
          "source_refs": [
            "answer-001"
          ],
          "validated_by": [
            "user-001"
          ],
          "last_validated_at": "2026-07-14T12:00:00+09:00"
        }
      },
      "steps": [
        {
          "id": "step-export",
          "sequence": 1,
          "name": "ERP 데이터 다운로드",
          "action": "ERP에서 전월 매출 데이터를 CSV로 내려받는다.",
          "performer_refs": [
            "role-sales-ops"
          ],
          "input_refs": [],
          "output_refs": [
            "artifact-sales-csv"
          ],
          "system_refs": [
            "system-erp"
          ],
          "decision_refs": [],
          "exception_refs": [
            "exception-export-failure"
          ],
          "next_step_refs": [
            "step-update-excel"
          ],
          "duration_minutes": {
            "min": 5,
            "max": 15,
            "typical": 8
          },
          "wait_minutes": {
            "min": 0,
            "max": 5,
            "typical": 1
          },
          "manual_touch": true,
          "reversible": true,
          "meta": {
            "state": "CONFIRMED",
            "confidence": 0.9,
            "source_refs": [
              "answer-001"
            ],
            "validated_by": [
              "user-001"
            ],
            "last_validated_at": "2026-07-14T12:00:00+09:00"
          }
        },
        {
          "id": "step-update-excel",
          "sequence": 2,
          "name": "Excel 템플릿 갱신",
          "action": "CSV 데이터를 기존 Excel 템플릿에 붙여넣고 수식을 갱신한다.",
          "performer_refs": [
            "role-sales-ops"
          ],
          "input_refs": [
            "artifact-sales-csv",
            "artifact-report-template"
          ],
          "output_refs": [
            "artifact-report-draft"
          ],
          "system_refs": [
            "system-excel"
          ],
          "decision_refs": [],
          "exception_refs": [
            "exception-column-change"
          ],
          "next_step_refs": [
            "step-review-variance"
          ],
          "duration_minutes": {
            "min": 15,
            "max": 45,
            "typical": 25
          },
          "wait_minutes": {
            "min": 0,
            "max": 0,
            "typical": 0
          },
          "manual_touch": true,
          "reversible": true,
          "meta": {
            "state": "CONFIRMED",
            "confidence": 0.9,
            "source_refs": [
              "answer-001"
            ],
            "validated_by": [
              "user-001"
            ],
            "last_validated_at": "2026-07-14T12:00:00+09:00"
          }
        },
        {
          "id": "step-review-variance",
          "sequence": 3,
          "name": "이상 증감 검토",
          "action": "전월 대비 큰 증감이 있는 거래처를 확인하고 설명을 작성한다.",
          "performer_refs": [
            "role-sales-ops"
          ],
          "input_refs": [
            "artifact-report-draft"
          ],
          "output_refs": [
            "artifact-report-reviewed"
          ],
          "system_refs": [
            "system-excel",
            "system-email"
          ],
          "decision_refs": [
            "decision-significant-variance"
          ],
          "exception_refs": [],
          "next_step_refs": [
            "step-approve-send"
          ],
          "duration_minutes": {
            "min": 20,
            "max": 90,
            "typical": 40
          },
          "wait_minutes": {
            "min": 0,
            "max": 1440,
            "typical": 60
          },
          "manual_touch": true,
          "reversible": true,
          "meta": {
            "state": "CONFIRMED",
            "confidence": 0.9,
            "source_refs": [
              "answer-001"
            ],
            "validated_by": [
              "user-001"
            ],
            "last_validated_at": "2026-07-14T12:00:00+09:00"
          }
        },
        {
          "id": "step-approve-send",
          "sequence": 4,
          "name": "팀장 검토 및 발송",
          "action": "팀장이 보고서를 확인한 뒤 경영진에게 이메일로 발송한다.",
          "performer_refs": [
            "role-sales-manager"
          ],
          "input_refs": [
            "artifact-report-reviewed"
          ],
          "output_refs": [
            "artifact-report-final"
          ],
          "system_refs": [
            "system-email"
          ],
          "decision_refs": [],
          "exception_refs": [],
          "next_step_refs": [],
          "duration_minutes": {
            "min": 5,
            "max": 20,
            "typical": 10
          },
          "wait_minutes": {
            "min": 10,
            "max": 480,
            "typical": 60
          },
          "manual_touch": true,
          "reversible": false,
          "meta": {
            "state": "CONFIRMED",
            "confidence": 0.9,
            "source_refs": [
              "answer-001"
            ],
            "validated_by": [
              "user-001"
            ],
            "last_validated_at": "2026-07-14T12:00:00+09:00"
          }
        }
      ],
      "variants": [
        {
          "id": "variant-new-account",
          "name": "신규 거래처 포함 월",
          "condition": "신규 거래처 매출이 포함된 경우 담당 영업에게 설명을 확인한다.",
          "step_refs": [
            "step-review-variance"
          ],
          "meta": {
            "state": "CORROBORATED",
            "confidence": 0.85,
            "source_refs": [
              "answer-017",
              "answer-022"
            ],
            "validated_by": [
              "user-001"
            ],
            "last_validated_at": "2026-07-14T12:00:00+09:00"
          }
        }
      ],
      "frequency": {
        "count": {
          "min": 1,
          "max": 1,
          "typical": 1
        },
        "period": "MONTH",
        "meta": {
          "state": "CONFIRMED",
          "confidence": 0.9,
          "source_refs": [
            "answer-001"
          ],
          "validated_by": [
            "user-001"
          ],
          "last_validated_at": "2026-07-14T12:00:00+09:00"
        }
      },
      "volume": {
        "count": {
          "min": 1,
          "max": 1,
          "typical": 1
        },
        "period": "MONTH",
        "scope": "TEAM",
        "meta": {
          "state": "CONFIRMED",
          "confidence": 0.9,
          "source_refs": [
            "answer-001"
          ],
          "validated_by": [
            "user-001"
          ],
          "last_validated_at": "2026-07-14T12:00:00+09:00"
        }
      },
      "meta": {
        "state": "CONFIRMED",
        "confidence": 0.9,
        "source_refs": [
          "answer-001"
        ],
        "validated_by": [
          "user-001"
        ],
        "last_validated_at": "2026-07-14T12:00:00+09:00"
      }
    }
  ],
  "artifacts": [
    {
      "id": "artifact-sales-csv",
      "kind": "FILE",